 {
   "$id": "http://example.com/example.json", 
   "$schema": "http://json-schema.org/draft-06/schema#", 
   "definitions": {}, 
   "items": {
     "$id": "/items", 
     "properties": {
        "adj": {
          "$id": "/items/properties/adj", 
         "items": {
           "$id": "/items/properties/adj/items", 
           "title": "The 0 Schema.", 
           "type": "string"
         }, 
         "type": "array"
       }, 
       "location": {
         "$id": "/items/properties/location", 
         "items": {
           "$id": "/items/properties/location/items", 
           "title": "The 0 Schema.", 
           "type": "string"
         }, 
         "type": "array"
       }, 
       "name": {
         "$id": "/items/properties/name", 
         "title": "The Name Schema.", 
         "type": "string"
       }, 
       "personality": {
         "$id": "/items/properties/personality", 
         "title": "The Personality Schema.", 
         "type": "string"
       }, 
       "sentiment": {
         "$id": "/items/properties/sentiment", 
         "title": "The Sentiment Schema.", 
         "type": "string"
       }, 
       "verb": {
         "$id": "/items/properties/verb", 
         "items": {
           "$id": "/items/properties/verb/items", 
           "title": "The 0 Schema.", 
           "type": "string"
         }, 
         "type": "array"
       }
     }, 
     "type": "object"
   }, 
   "type": "array"
 }

